{
  "schema_version": 1,
  "trace_id": "fast_improver",
  "description": "A learner who meets every criterion at every corner from the first lap. The lap-budget case framing v6 puts at 9-11 laps: broad qualification at full salience, the dwell the re-qualification reset enforces at reduced, then the 3-lap probe. All three elements traverse full -> reduced -> probe -> removed.",
  "applicable": {
    "braking": [
      "1",
      "2",
      "3",
      "4"
    ],
    "corner_speed": [
      "1",
      "2",
      "3",
      "4"
    ],
    "apex": [
      "1",
      "2",
      "3",
      "4"
    ]
  },
  "passes": [
    {
      "corner_id": "1",
      "lap": 0,
      "t": 12.0,
      "criteria": {
        "braking": true,
        "corner_speed": true,
        "apex": true
      }
    },
    {
      "corner_id": "2",
      "lap": 0,
      "t": 24.0,
      "criteria": {
        "braking": true,
        "corner_speed": true,
        "apex": true
      }
    },
    {
      "corner_id": "3",
      "lap": 0,
      "t": 36.0,
      "criteria": {
        "braking": true,
        "corner_speed": true,
        "apex": true
      }
    },
    {
      "corner_id": "4",
      "lap": 0,
      "t": 48.0,
      "criteria": {
        "braking": true,
        "corner_speed": true,
        "apex": true
      }
    },
    {
      "corner_id": "1",
      "lap": 1,
      "t": 72.0,
      "criteria": {
        "braking": true,
        "corner_speed": true,
        "apex": true
      }
    },
    {
      "corner_id": "2",
      "lap": 1,
      "t": 84.0,
      "criteria": {
        "braking": true,
        "corner_speed": true,
        "apex": true
      }
    },
    {
      "corner_id": "3",
      "lap": 1,
      "t": 96.0,
      "criteria": {
        "braking": true,
        "corner_speed": true,
        "apex": true
      }
    },
    {
      "corner_id": "4",
      "lap": 1,
      "t": 108.0,
      "criteria": {
        "braking": true,
        "corner_speed": true,
        "apex": true
      }
    },
    {
      "corner_id": "1",
      "lap": 2,
      "t": 132.0,
      "criteria": {
        "braking": true,
        "corner_speed": true,
        "apex": true
      }
    },
    {
      "corner_id": "2",
      "lap": 2,
      "t": 144.0,
      "criteria": {
        "braking": true,
        "corner_speed": true,
        "apex": true
      }
    },
    {
      "corner_id": "3",
      "lap": 2,
      "t": 156.0,
      "criteria": {
        "braking": true,
        "corner_speed": true,
        "apex": true
      }
    },
    {
      "corner_id": "4",
      "lap": 2,
      "t": 168.0,
      "criteria": {
        "braking": true,
        "corner_speed": true,
        "apex": true
      }
    },
    {
      "corner_id": "1",
      "lap": 3,
      "t": 192.0,
      "criteria": {
        "braking": true,
        "corner_speed": true,
        "apex": true
      }
    },
    {
      "corner_id": "2",
      "lap": 3,
      "t": 204.0,
      "criteria": {
        "braking": true,
        "corner_speed": true,
        "apex": true
      }
    },
    {
      "corner_id": "3",
      "lap": 3,
      "t": 216.0,
      "criteria": {
        "braking": true,
        "corner_speed": true,
        "apex": true
      }
    },
    {
      "corner_id": "4",
      "lap": 3,
      "t": 228.0,
      "criteria": {
        "braking": true,
        "corner_speed": true,
        "apex": true
      }
    },
    {
      "corner_id": "1",
      "lap": 4,
      "t": 252.0,
      "criteria": {
        "braking": true,
        "corner_speed": true,
        "apex": true
      }
    },
    {
      "corner_id": "2",
      "lap": 4,
      "t": 264.0,
      "criteria": {
        "braking": true,
        "corner_speed": true,
        "apex": true
      }
    },
    {
      "corner_id": "3",
      "lap": 4,
      "t": 276.0,
      "criteria": {
        "braking": true,
        "corner_speed": true,
        "apex": true
      }
    },
    {
      "corner_id": "4",
      "lap": 4,
      "t": 288.0,
      "criteria": {
        "braking": true,
        "corner_speed": true,
        "apex": true
      }
    },
    {
      "corner_id": "1",
      "lap": 5,
      "t": 312.0,
      "criteria": {
        "braking": true,
        "corner_speed": true,
        "apex": true
      }
    },
    {
      "corner_id": "2",
      "lap": 5,
      "t": 324.0,
      "criteria": {
        "braking": true,
        "corner_speed": true,
        "apex": true
      }
    },
    {
      "corner_id": "3",
      "lap": 5,
      "t": 336.0,
      "criteria": {
        "braking": true,
        "corner_speed": true,
        "apex": true
      }
    },
    {
      "corner_id": "4",
      "lap": 5,
      "t": 348.0,
      "criteria": {
        "braking": true,
        "corner_speed": true,
        "apex": true
      }
    },
    {
      "corner_id": "1",
      "lap": 6,
      "t": 372.0,
      "criteria": {
        "braking": true,
        "corner_speed": true,
        "apex": true
      }
    },
    {
      "corner_id": "2",
      "lap": 6,
      "t": 384.0,
      "criteria": {
        "braking": true,
        "corner_speed": true,
        "apex": true
      }
    },
    {
      "corner_id": "3",
      "lap": 6,
      "t": 396.0,
      "criteria": {
        "braking": true,
        "corner_speed": true,
        "apex": true
      }
    },
    {
      "corner_id": "4",
      "lap": 6,
      "t": 408.0,
      "criteria": {
        "braking": true,
        "corner_speed": true,
        "apex": true
      }
    },
    {
      "corner_id": "1",
      "lap": 7,
      "t": 432.0,
      "criteria": {
        "braking": true,
        "corner_speed": true,
        "apex": true
      }
    },
    {
      "corner_id": "2",
      "lap": 7,
      "t": 444.0,
      "criteria": {
        "braking": true,
        "corner_speed": true,
        "apex": true
      }
    },
    {
      "corner_id": "3",
      "lap": 7,
      "t": 456.0,
      "criteria": {
        "braking": true,
        "corner_speed": true,
        "apex": true
      }
    },
    {
      "corner_id": "4",
      "lap": 7,
      "t": 468.0,
      "criteria": {
        "braking": true,
        "corner_speed": true,
        "apex": true
      }
    },
    {
      "corner_id": "1",
      "lap": 8,
      "t": 492.0,
      "criteria": {
        "braking": true,
        "corner_speed": true,
        "apex": true
      }
    },
    {
      "corner_id": "2",
      "lap": 8,
      "t": 504.0,
      "criteria": {
        "braking": true,
        "corner_speed": true,
        "apex": true
      }
    },
    {
      "corner_id": "3",
      "lap": 8,
      "t": 516.0,
      "criteria": {
        "braking": true,
        "corner_speed": true,
        "apex": true
      }
    },
    {
      "corner_id": "4",
      "lap": 8,
      "t": 528.0,
      "criteria": {
        "braking": true,
        "corner_speed": true,
        "apex": true
      }
    },
    {
      "corner_id": "1",
      "lap": 9,
      "t": 552.0,
      "criteria": {
        "braking": true,
        "corner_speed": true,
        "apex": true
      }
    },
    {
      "corner_id": "2",
      "lap": 9,
      "t": 564.0,
      "criteria": {
        "braking": true,
        "corner_speed": true,
        "apex": true
      }
    },
    {
      "corner_id": "3",
      "lap": 9,
      "t": 576.0,
      "criteria": {
        "braking": true,
        "corner_speed": true,
        "apex": true
      }
    },
    {
      "corner_id": "4",
      "lap": 9,
      "t": 588.0,
      "criteria": {
        "braking": true,
        "corner_speed": true,
        "apex": true
      }
    },
    {
      "corner_id": "1",
      "lap": 10,
      "t": 612.0,
      "criteria": {
        "braking": true,
        "corner_speed": true,
        "apex": true
      }
    },
    {
      "corner_id": "2",
      "lap": 10,
      "t": 624.0,
      "criteria": {
        "braking": true,
        "corner_speed": true,
        "apex": true
      }
    },
    {
      "corner_id": "3",
      "lap": 10,
      "t": 636.0,
      "criteria": {
        "braking": true,
        "corner_speed": true,
        "apex": true
      }
    },
    {
      "corner_id": "4",
      "lap": 10,
      "t": 648.0,
      "criteria": {
        "braking": true,
        "corner_speed": true,
        "apex": true
      }
    },
    {
      "corner_id": "1",
      "lap": 11,
      "t": 672.0,
      "criteria": {
        "braking": true,
        "corner_speed": true,
        "apex": true
      }
    },
    {
      "corner_id": "2",
      "lap": 11,
      "t": 684.0,
      "criteria": {
        "braking": true,
        "corner_speed": true,
        "apex": true
      }
    },
    {
      "corner_id": "3",
      "lap": 11,
      "t": 696.0,
      "criteria": {
        "braking": true,
        "corner_speed": true,
        "apex": true
      }
    },
    {
      "corner_id": "4",
      "lap": 11,
      "t": 708.0,
      "criteria": {
        "braking": true,
        "corner_speed": true,
        "apex": true
      }
    }
  ],
  "expected_events": [
    {
      "element": "braking",
      "transition": "full_to_reduced",
      "t": 168.0,
      "lap": 2,
      "quorum": {
        "qualified_share": 1.0,
        "qualified_corners": [
          "1",
          "2",
          "3",
          "4"
        ],
        "applicable_corners": 4,
        "flipped_corners": [
          "4"
        ]
      }
    },
    {
      "element": "corner_speed",
      "transition": "full_to_reduced",
      "t": 168.0,
      "lap": 2,
      "quorum": {
        "qualified_share": 1.0,
        "qualified_corners": [
          "1",
          "2",
          "3",
          "4"
        ],
        "applicable_corners": 4,
        "flipped_corners": [
          "4"
        ]
      }
    },
    {
      "element": "apex",
      "transition": "full_to_reduced",
      "t": 168.0,
      "lap": 2,
      "quorum": {
        "qualified_share": 1.0,
        "qualified_corners": [
          "1",
          "2",